{"$schema": "http://json-schema.org/draft-07/schema#", "title": "Skill Registry Entry", "description": "每个 .agents/skills/<name>/SKILL.md 对应的元数据条目", "type": "object", "required": ["name", "description", "primary_action", "expected_tool_calls", "validation_commands", "owner_domain", "layer_constraints", "known_failure_modes"], "properties": {"name": {"type": "string", "pattern": "^[a-z][a-z0-9-]+$", "description": "Skill 唯一标识，与 .agents/skills/ 目录名一致"}, "description": {"type": "string", "description": "一句话说明 skill 用途"}, "primary_action": {"type": "string", "description": "Skill 的核心动作", "examples": ["write_file", "run_tests", "analyze_replay", "edit_scene", "benchmark"]}, "primary_script": {"type": ["string", "null"], "description": "Skill 包内被首先调用的脚本路径，如 'scripts/validate.py'", "default": null}, "expected_tool_calls": {"type": "array", "items": {"type": "string"}, "description": "执行此 skill 时必须出现的 tool call（silent-bypass 检测）", "minItems": 1, "examples": [["Read", "Write", "Bash"], ["Read", "Grep", "Bash"]]}, "validation_commands": {"type": "array", "items": {"type": "string"}, "description": "验证 skill 输出是否正确的命令列表", "minItems": 1, "examples": [["python3 -m pytest tests/ -q -x"], ["godot --headless --check-only"]]}, "owner_domain": {"type": "string", "enum": ["team-simcore", "team-ai", "team-balance", "team-release", "godot-specialist", "harness-executor", "cross-cutting"]}, "layer_constraints": {"type": "array", "items": {"type": "string", "enum": ["proto", "simcore", "agents", "frontend-godot", "dev-harness"]}, "minItems": 1, "description": "此 skill 允许读写的架构层"}, "known_failure_modes": {"type": "array", "items": {"type": "object", "required": ["pattern", "mitigation"], "properties": {"pattern": {"type": "string"}, "mitigation": {"type": "string"}}}, "minItems": 1, "description": "已知的失败模式和缓解策略"}, "silent_bypass_risks": {"type": "array", "items": {"type": "string"}, "description": "此 skill 可能被 silent-bypass 的场景"}, "version": {"type": "string", "default": "0.1.0"}, "last_evolved": {"type": ["string", "null"], "format": "date-time", "default": null}, "held_out_suite": {"type": ["string", "null"], "default": null}}}